<?xml version="1.0"?>
<webapp 
  xmlns="http://www.armatiek.com/xslweb/webapp"
  xmlns:xs="http://www.w3.org/2001/XMLSchema"
  xmlns:xsi="http://www.w3.org/2001/XMLSchema-instance"
  xsi:schemaLocation="http://www.armatiek.com/xslweb/webapp ../../config/xsd/xslweb/webapp.xsd">
  
  <title>Root web application</title>
  <description>Root web application</description>
  <development-mode>false</development-mode>
  <max-upload-size>10</max-upload-size>
  
  <!-- Resources to serve straight away: -->
  <resources>
    <resource pattern="/favicon.ico" media-type="image/x-icon" duration="P7DT0H0M0S"/>
    <resource pattern="/robots.txt" media-type="text/plain" duration="P1DT0H0M0S"/>    
    <resource pattern="/images/.+\.png" media-type="image/png"/>
    <resource pattern="/images/.+\.gif" media-type="image/gif"/>
    <resource pattern="/images/.+\.(jpg|jpeg)" media-type="image/jpg"/>
    <resource pattern="/scripts/.+\.js" media-type="text/javascript"/>
    <resource pattern="/styles/.+\.css" media-type="text/css"/>
  </resources>
  
</webapp>