<?xml version="1.0"?>
<webapp 
  xmlns="http://www.armatiek.com/xslweb/webapp"
  xmlns:xs="http://www.w3.org/2001/XMLSchema"
  xmlns:xsi="http://www.w3.org/2001/XMLSchema-instance"
  xmlns:va="http://www.armatiek.nl/xmlindex/virtualattribute"
  xsi:schemaLocation="http://www.armatiek.com/xslweb/webapp ../../config/xsd/xslweb/webapp.xsd">
  
  <title>XSLWeb/XMLIndex IDE</title>
  <description>XSLWeb/XMLIndex IDE</description>
  <development-mode>true</development-mode>
  <max-upload-size>100</max-upload-size>
  
  <!-- Resources to serve straight away: -->
  <resources> 
    <resource pattern="/favicon.ico" media-type="image/x-icon" duration="P7DT0H0M0S"/>
    <resource pattern="/robots.txt" media-type="text/plain" duration="P1DT0H0M0S"/> 
    <resource pattern="/.+\.png" media-type="image/png"/>
    <resource pattern="/.+\.gif" media-type="image/gif"/>
    <resource pattern="/.+\.(jpg|jpeg)" media-type="image/jpg"/>
    <resource pattern="/.+\.js" media-type="text/javascript"/>
    <resource pattern="/.+\.css" media-type="text/css"/>
    <resource pattern="/.+\.woff" media-type="application/font-woff"/>
    <resource pattern="/.+\.woff2" media-type="application/font-woff2"/>
    <resource pattern="/.+\.ttf" media-type="application/x-font-ttf"/>
  </resources>
  
  <indexes>
    
    <index>
      <name>BWB</name>
      <path>indexes/index-bwb</path>
      <max-term-length>1024</max-term-length>
      <index-compression>no_compression</index-compression>
    </index>
    
    <index>
      <name>Test Index</name>
      <path>indexes/index-tests</path>  
    </index>
    
    <index>
      <name>PUC Open Data</name>
      <path>indexes/index-pod</path>
    </index>
    
  </indexes>
  
</webapp>